{
  "catalogue_version": "1.0.0",
  "suite": {
    "root": "services/orchestrator",
    "command": [
      "-m",
      "unittest",
      "discover",
      "-s",
      "tests",
      "-t",
      "."
    ]
  },
  "threshold_percent": 80,
  "mutants": [
    {
      "file": "scope/resolution.py",
      "property": "every resolved address is checked, not only the first",
      "find": "for address in addresses:",
      "replace": "for address in addresses[:1]:"
    },
    {
      "file": "scope/resolution.py",
      "property": "a name that resolves to nothing gives no permission to connect",
      "find": "if not answers:",
      "replace": "if False:"
    },
    {
      "file": "scope/resolution.py",
      "property": "a redirect is validated again rather than inheriting the previous pin",
      "find": "pinned = resolve_url_and_pin(location, resolver)",
      "replace": "pinned = previous"
    },
    {
      "file": "scope/resolution.py",
      "property": "a connection may only use an address the pin authorised",
      "find": "if address not in pinned.addresses:",
      "replace": "if False:"
    },
    {
      "file": "scope/resolution.py",
      "property": "one name answering differently within an execution is refused",
      "find": "if pinned.hostname == previous.hostname and set(pinned.addresses) != set(",
      "replace": "if False and set(pinned.addresses) != set("
    },
    {
      "file": "scope/resolution.py",
      "property": "only loopback and private answers may be connected to",
      "find": "_CONNECT_PERMITTED: Final = frozenset({\"loopback\", \"private\"})",
      "replace": "_CONNECT_PERMITTED: Final = frozenset({\"loopback\", \"private\", \"public\", \"link-local\"})"
    },
    {
      "file": "scope/resolution.py",
      "property": "a destination the signed scope could not contain is never resolved",
      "find": "if not is_scope_eligible(target, \"hostname\") and not is_scope_eligible(",
      "replace": "if False and not is_scope_eligible("
    },
    {
      "file": "scope/address_policy.py",
      "property": "a URL carrying a control character is refused before parsing",
      "find": "if any(character <= \" \" or character == \"\\x7f\" for character in value):",
      "replace": "if False:"
    },
    {
      "file": "scope/address_policy.py",
      "property": "a port outside the real range is not classified by its host",
      "find": "        parts.port\n    except ValueError:",
      "replace": "        pass\n    except ValueError:"
    },
    {
      "file": "scope/address_policy.py",
      "property": "a case-folded authority is not eligible, because a signed scope is lowercase",
      "find": "if parts.netloc != parts.netloc.lower():",
      "replace": "if False:"
    },
    {
      "file": "scope/address_policy.py",
      "property": "a case-folded hostname is not eligible either",
      "find": "if value != value.lower():",
      "replace": "if False:"
    },
    {
      "file": "scope/address_policy.py",
      "property": "the named special ranges decide before ipaddress.is_private ever could",
      "find": "    if address == _BROADCAST:",
      "replace": "    if address.is_private:\n        return \"private\"\n    if address == _BROADCAST:"
    },
    {
      "file": "scope/address_policy.py",
      "property": "an absolute name is refused, because the scope pattern has no trailing dot",
      "find": "return not value.endswith(\".\")",
      "replace": "return True"
    },
    {
      "file": "grants/execution_grant.py",
      "property": "a refused grant does not burn its nonce, because the check never consumes",
      "find": "    nonce = str(grant.get(\"nonce\"))",
      "replace": "    nonce = str(grant.get(\"nonce\")); replay_cache.consume(nonce, now)"
    },
    {
      "file": "grants/execution_grant.py",
      "property": "the replay cache retains a nonce for as long as its grant is acceptable",
      "find": "if seen >= horizon",
      "replace": "if seen > horizon"
    },
    {
      "file": "grants/execution_grant.py",
      "property": "a replay cache too short to cover the acceptance window is refused",
      "find": "if self.ttl_seconds < MAXIMUM_LIFETIME_SECONDS + 2 * CLOCK_SKEW_SECONDS:",
      "replace": "if False:"
    },
    {
      "file": "grants/execution_grant.py",
      "property": "the signature is compared in constant time and must match",
      "find": "if not isinstance(presented, str) or not hmac.compare_digest(presented, expected):",
      "replace": "if False:"
    },
    {
      "file": "grants/execution_grant.py",
      "property": "an unknown key_id is refused rather than defaulted",
      "find": "if not isinstance(key_id, str) or key_id not in trusted_keys:",
      "replace": "if False:"
    },
    {
      "file": "grants/execution_grant.py",
      "property": "clock skew is tolerated on the past edge only as far as the constant allows",
      "find": "if now > expires + skew:",
      "replace": "if False:"
    },
    {
      "file": "grants/execution_grant.py",
      "property": "a stretched window is refused even when correctly signed",
      "find": "if (expires - issued).total_seconds() > MAXIMUM_LIFETIME_SECONDS:",
      "replace": "if False:"
    },
    {
      "file": "grants/execution_grant.py",
      "property": "a grant cannot be presented for another run",
      "find": "if grant.get(\"run_id\") != run_id:",
      "replace": "if False:"
    },
    {
      "file": "grants/execution_grant.py",
      "property": "a grant cannot claim a scope snapshot other than the one it references",
      "find": "if grant.get(\"scope_hash\") != scope_hash:",
      "replace": "if False:"
    },
    {
      "file": "grants/execution_grant.py",
      "property": "a revoked run refuses its grants",
      "find": "if run_id in revoked_runs:",
      "replace": "if False:"
    },
    {
      "file": "grants/execution_grant.py",
      "property": "a grant longer than the maximum cannot be issued",
      "find": "if lifetime_seconds > MAXIMUM_LIFETIME_SECONDS:",
      "replace": "if False:"
    },
    {
      "file": "grants/execution_grant.py",
      "property": "a grant naming a profile the contract forbids is refused",
      "find": "if grant.get(\"profile\") not in _PROFILES:",
      "replace": "if False:"
    },
    {
      "file": "grants/execution_grant.py",
      "property": "a pinned address must be a resolved literal, never a name",
      "find": "            or not _ADDRESS.fullmatch(address)",
      "replace": "            or False"
    },
    {
      "file": "grants/execution_grant.py",
      "property": "a signed grant is still checked against the contract shape",
      "find": "    _assert_contract_shape(grant)\n\n    issued = _parse_timestamp(",
      "replace": "    pass\n\n    issued = _parse_timestamp("
    },
    {
      "file": "grants/execution_grant.py",
      "property": "the issuer cannot mint a document the contract rejects",
      "find": "    _assert_contract_shape(grant)\n\n    return grant",
      "replace": "    pass\n\n    return grant"
    },
    {
      "file": "grants/execution_grant.py",
      "property": "a grant carrying an unknown field is refused",
      "find": "    if unknown:",
      "replace": "    if False:"
    },
    {
      "file": "grants/execution_grant.py",
      "property": "duplicate pinned addresses are refused",
      "find": "    if len(set(addresses)) != len(addresses):",
      "replace": "    if False:"
    },
    {
      "file": "audit/chain.py",
      "property": "an altered entry is detected by its digest",
      "find": "if not hmac.compare_digest(str(entry[\"entry_digest\"]), expected):",
      "replace": "if False:"
    },
    {
      "file": "audit/chain.py",
      "property": "a broken link between two entries is detected",
      "find": "if entry[\"previous_digest\"] != previous:",
      "replace": "if False:"
    },
    {
      "file": "audit/chain.py",
      "property": "a removed or reordered entry is detected by its sequence",
      "find": "if entry[\"sequence\"] != position:",
      "replace": "if False:"
    },
    {
      "file": "audit/chain.py",
      "property": "a truncated chain fails against an anchored head digest",
      "find": "if expected_head is not None and previous != expected_head:",
      "replace": "if False:"
    },
    {
      "file": "audit/chain.py",
      "property": "an entry with no facts is refused",
      "find": "    if not isinstance(facts, (list, tuple)) or not facts:",
      "replace": "    if False:"
    },
    {
      "file": "audit/chain.py",
      "property": "a fact cannot declare a type outside the contract vocabulary",
      "find": "if fact[\"type\"] not in _FACT_TYPES:",
      "replace": "if False:"
    },
    {
      "file": "audit/chain.py",
      "property": "a fact value is length bounded so it cannot smuggle a payload",
      "find": "if not isinstance(value, str) or not 1 <= len(value) <= _MAXIMUM_FACT_LENGTH:",
      "replace": "if False:"
    },
    {
      "file": "audit/chain.py",
      "property": "an undeclared action cannot be logged",
      "find": "if entry.get(\"action\") not in _ACTIONS:",
      "replace": "if False:"
    },
    {
      "file": "audit/chain.py",
      "property": "a refused entry never enters the chain",
      "find": "        _assert_entry_shape(entry)\n\n        self.entries.append(entry)",
      "replace": "        self.entries.append(entry)"
    },
    {
      "file": "audit/recorder.py",
      "property": "an allowed decision that cannot be recorded is refused rather than returned",
      "find": "    record(\n        chain,\n        entry_id=entry_id,\n        action=action,\n        outcome=\"allowed\",",
      "replace": "    _ = (\n        chain,\n        entry_id,\n        action,\n        \"allowed\","
    },
    {
      "file": "audit/recorder.py",
      "property": "a refusal is written to the record before it is re-raised",
      "find": "            record(\n                chain,",